{
  "schemaVersion": 1,
  "capabilityId": "deal-strategy",
  "enterpriseId": "replace-with-enterprise-id",
  "taskId": "replace-with-task-id",
  "version": 1,
  "customerInsightRef": {
    "taskId": "replace-with-insight-task-id",
    "version": 1,
    "sha256": "replace-with-sha256"
  },
  "communicationStrategy": {
    "objectives": [],
    "questions": [],
    "channels": []
  },
  "valueEvidenceMatrix": [],
  "objectionHandling": [],
  "dealPath": [],
  "followUpPlan": {
    "cadence": [],
    "stopAfter": []
  },
  "evidenceIndex": [],
  "unknowns": [],
  "downstreamBrief": {
    "salesTraining": {
      "scenarios": [],
      "scoringFocus": []
    }
  },
  "clientAutonomy": {
    "pressureTacticsUsed": false,
    "guaranteeMade": false,
    "noSaleAllowed": true
  },
  "externalActions": []
}
